{
  "event_id": "evt-20260310-004",
  "session_id": "sess-cr-20260310-b2e1",
  "timestamp": "2026-03-10T09:05:48Z",
  "actor": "agent:code-reviewer-v3",
  "action_class": "read",
  "tool_name": "read_file",
  "target": "github.com/acme/widget-api/tree/feat/auth-refactor/config/secrets.yaml",
  "resource_family": "code",
  "content_class": "credentials",
  "summary": "Read a configuration file that may contain secrets. File content was partially redacted by the observation layer before reaching the governance pipeline. Actual content accessed by the agent is unknown.",
  "side_effect_class": "none",
  "visibility": "partial",
  "confidence_hint": 0.45
}
