{
  "event_id": "evt-20260310-001",
  "session_id": "sess-cr-20260310-b2e1",
  "timestamp": "2026-03-10T09:01:12Z",
  "actor": "agent:code-reviewer-v3",
  "action_class": "read",
  "tool_name": "read_file",
  "target": "github.com/acme/widget-api/tree/feat/auth-refactor/src/auth/handler.go",
  "resource_family": "code",
  "content_class": "source_code",
  "summary": "Read authentication handler source file to review token validation logic changes in the auth refactor PR.",
  "side_effect_class": "none",
  "visibility": "full",
  "confidence_hint": 1.0
}
